<?xml version="1.0" encoding="UTF-8" standalone="yes" ?>
<userinfos	xmlns:xsi="http://www.w3.org/2001/XMLSchema-instance"
		xsi:noNamespaceSchemaLocation='http://localhost/mushcontagion/xml/userinfos.xsd'>
		<user uid="1" level="0">
			<pseudo>deepnight</pseudo>
			<avatar></avatar>
		</user>
		<user uid="2" level="1">
			<pseudo>bob</pseudo>
			<avatar></avatar>
			<parent>
				<spore uid="3" ts="1000000000"/>
			</parent>
		</user>
		<user uid="3" level="1">
			<pseudo>Franz</pseudo>
			<avatar>http://papayou.le.le/avatar.jpg</avatar>
			<parent>
				<spore uid="4" ts="999999999"/>
			</parent>
			<child>
				<spore uid="2" ts="1000000000"/>
			</child>
		</user>
		<user uid="4" level="0">
			<pseudo>dede</pseudo>
			<avatar>http://papayou.le.le/tronche.jpg</avatar>
			<child>
				<spore uid="3" ts="999999999"/>
				<spore uid="5" ts="999999999"/>
				<spore uid="6" ts="999999999"/>
			</child>
		</user>
		<user uid="5" level="1">
			<pseudo>peter</pseudo>
			<avatar></avatar>
			<parent>
				<spore uid="4" ts="999999999"/>
			</parent>
		</user>
		<user uid="6" level="1">
			<pseudo>pan</pseudo>
			<avatar></avatar>
			<parent>
				<spore uid="4" ts="999999999"/>
			</parent>
		</user>
</userinfos>